<?xml version="1.0" encoding="UTF-8"?>
<!-- 
****************************************************************************
** Licensed Materials - Property of IBM
**
** Governed under the terms of the International
** License Agreement for Non-Warranted Sample Code.
**
** (C) COPYRIGHT International Business Machines Corp. 2007
** All Rights Reserved.
**
** US Government Users Restricted Rights - Use, duplication or
** disclosure restricted by GSA ADP Schedule Contract with IBM Corp.
*****************************************************************************
**
** SOURCE FILE NAME: db2ha_sample_DPF_NPlusM.xml 
**
** SAMPLE: Initial Setup Configuration of DB2 HA DPF failover automation using db2haicu
** 
** FUNCTION: This sample showcases the way in which one can write XML configuration file for
**	failover automation using db2haicu HA utility
**
** USAGE: db2haicu -f db2ha_sample_DPF_NPlusM.xml 
**	
** DESCRIPTION: The environment for this sample is described below:
** 		
**	 1. The physical topology is already setup and available
**	     The hardware topology is includes the following
**		- 4 computers (hasys01, hasys02, hasys03, hasys04)
**		- 2 NIC/box (eth0/eth1 on both systems)
**		- 1 Virtual IP address (19.126.124.250)
**		- 4 shared failover mount points 
**    /ha_dpf1/db2inst1/NODE0000
**    /hafs/NODE0000
**    /ha_dpf1/db2inst1/NODE0001
**    /hafs/NODE0001
**	2. DB2 has to be installed on all nodes (hasys01,hasys02,hasys03,hasys04)
**	3. Cluster manager has to be installed and running on all nodes
**
** PREREQUISITES:
**	1. Hardware installed and configured (physical networks, shared-disk storage system	
**	2. IP addresses reserved or assigned
**	3. OS is installed, patched and configured (including the shared-disk storage system)
**	4. Users, groups and authentication set-up on both machines
**	5. TSA v2.2 installed and configured on both nodes
**	6. Gathering the information on hardware specifications like IP, NIC, and shared storage
**	7. Root privilege is required while installing the DB2
**
*****************************************************************************
*****************************************************************************
**
** For detailed information about database backup and database recovery, see
** the Data Recovery and High Availability Guide and Reference. This manual
** will help you to determine which database and table space recovery methods
** are best suited to your business environment.
**
** For more information on the sample programs, see the README file.
**
** For information on developing C applications, see the Application
** Development Guide.
**
** For information on using SQL statements, see the SQL Reference.
**
** For information on DB2 APIs, see the Administrative API Reference.
**
** For the latest information on programming, building, and running DB2
** applications, visit the DB2 application development website:
**     http://www.software.ibm.com/data/db2/udb/ad
****************************************************************************/
-->
  <!-- ================================================================= -->
  <!-- = DB2 High Availability configuration schema                    = -->
  <!-- = Schema describes the elements of DB2 High Availability        = --> 
  <!-- = that are used in the configuration of a HA cluster            = -->
  <!-- ================================================================= -->
<DB2Cluster xmlns:xsi="http://www.w3.org/2001/XMLSchema-instance" xsi:noNamespaceSchemaLocation="db2ha.xsd" clusterManagerName="TSA" version="1.0">
  <ClusterDomain domainName="db2HAdomain">
      <Quorum quorumDeviceProtocol="network"  quorumDeviceName="19.126.4.5"/>
      <PhysicalNetwork physicalNetworkName="db2_public_network_0" physicalNetworkProtocol="ip">
      <Interface interfaceName="eth0" clusterNodeName="hasys01">
        <IPAddress baseAddress="19.126.124.30" subnetMask="255.255.255.0" networkName="db2_public_network_0"/>
      </Interface>              
      <Interface interfaceName="eth0" clusterNodeName="hasys02">
        <IPAddress baseAddress="19.126.124.31" subnetMask="255.255.255.0" networkName="db2_public_network_0"/>
      </Interface>              
      <Interface interfaceName="eth0" clusterNodeName="hasys03">
        <IPAddress baseAddress="19.126.124.32" subnetMask="255.255.255.0" networkName="db2_public_network_0"/>
      </Interface>              
      <Interface interfaceName="eth0" clusterNodeName="hasys04">
        <IPAddress baseAddress="19.126.124.33" subnetMask="255.255.255.0" networkName="db2_public_network_0"/>
      </Interface>              
      </PhysicalNetwork>

      <PhysicalNetwork physicalNetworkName="db2_private_network_0" physicalNetworkProtocol="ip">
      <Interface interfaceName="eth1" clusterNodeName="hasys01">
        <IPAddress baseAddress="192.168.23.101" subnetMask="255.255.255.0" networkName="db2_private_network_0"/>
      </Interface>              
      <Interface interfaceName="eth1" clusterNodeName="hasys02">
        <IPAddress baseAddress="192.168.23.102" subnetMask="255.255.255.0" networkName="db2_private_network_0"/>
      </Interface>              
      <Interface interfaceName="eth1" clusterNodeName="hasys03">
        <IPAddress baseAddress="192.168.23.103" subnetMask="255.255.255.0" networkName="db2_private_network_0"/>
      </Interface>              
      <Interface interfaceName="eth1" clusterNodeName="hasys04">
        <IPAddress baseAddress="192.168.23.104" subnetMask="255.255.255.0" networkName="db2_private_network_0"/>
      </Interface>              
      </PhysicalNetwork>
 
    <ClusterNode clusterNodeName="hasys01"/>
    <ClusterNode clusterNodeName="hasys02"/>
    <ClusterNode clusterNodeName="hasys03"/>
    <ClusterNode clusterNodeName="hasys04"/>
  </ClusterDomain>
  <FailoverPolicy>
     <NPlusM></NPlusM>
  </FailoverPolicy>
  <DB2PartitionSet>
    <DB2Partition dbpartitionnum="0" instanceName="db2inst1">
      <VirtualIPAddress baseAddress="19.126.124.250" subnetMask="255.255.255.0" networkName="db2_public_network_0"/>
      <Mount filesystemPath="/ha_dpf1/db2inst1/NODE0000" />
      <Mount filesystemPath="/hafs/NODE0000" />
      <NPlusMNode standbyNodeName="hasys03" /> 
    </DB2Partition>
    <DB2Partition dbpartitionnum="1" instanceName="db2inst1">
      <Mount filesystemPath="/ha_dpf1/db2inst1/NODE0001" />
      <Mount filesystemPath="/hafs/NODE0001" />
 
      <NPlusMNode standbyNodeName="hasys04" /> 
    </DB2Partition>
  </DB2PartitionSet>
</DB2Cluster>

