<?xml version="1.0" encoding="UTF-8"?>
<!-- 
****************************************************************************
** Licensed Materials - Property of IBM
**
** Governed under the terms of the International
** License Agreement for Non-Warranted Sample Code.
**
** (C) COPYRIGHT International Business Machines Corp. 2007
** All Rights Reserved.
**
** US Government Users Restricted Rights - Use, duplication or
** disclosure restricted by GSA ADP Schedule Contract with IBM Corp.
*****************************************************************************
**
** SOURCE FILE NAME: db2ha_sample_sharedstorage_mutual.xml 
**
** SAMPLE: Initial Setup Configuration of DB2 HA shared storage failover automation using db2haicu
** 
** FUNCTION: This sample showcases the way in which one can write XML configuration file for shared
**	failover automation using db2haicu HA utility
**
** USAGE: db2haicu -f db2ha_sample_sharedstorage_mutual.xml 
**	
** DESCRIPTION: The environment for this sample is described below:
** 		
**	 1. The physical topology is already setup and available
**	     The hardware topology is the following
**		- 2 computers (hasys01, hasys02)
**		- 1 NIC/box (eth0 on both systems)
**		- 1 Virtual IP address (19.126.52.222)
**		- 1 shared failover mount point disk (/home/db2inst1)
**	2. DB2 has to be installed on both nodes (hasys01 and hasys02)
**	3. Cluster manager has to be installed and running on both nodes (hasys01 and hasys02)
**	4. The instance and database are only created on hasys01 that to on shared disk
**
** PREREQUISITES:
**	1. Hardware installed and configured (physical networks, shared-disk storage system	
**	2. The Virtual IP address is reserved or assigned 
**	3. OS is installed, patched and configured (including the shared-disk storage system)
**	4. Users, groups and authentication set-up on both machines
**	5. TSA v2.2 installed and configured on both nodes
**	6. Gathering the information on hardware specifications like IP, NIC, and shared storage
**	7. Root privilege is required while installing the DB2
**
*****************************************************************************
*****************************************************************************
**
** For detailed information about database backup and database recovery, see
** the Data Recovery and High Availability Guide and Reference. This manual
** will help you to determine which database and table space recovery methods
** are best suited to your business environment.
**
** For more information on the sample programs, see the README file.
**
** For information on developing C applications, see the Application
** Development Guide.
**
** For information on using SQL statements, see the SQL Reference.
**
** For information on DB2 APIs, see the Administrative API Reference.
**
** For the latest information on programming, building, and running DB2
** applications, visit the DB2 application development website:
**     http://www.software.ibm.com/data/db2/udb/ad
****************************************************************************/
-->
  <!-- ================================================================= -->
  <!-- = DB2 High Availability configuration schema                    = -->
  <!-- = Schema describes the elements of DB2 High Availability        = --> 
  <!-- = that are used in the configuration of a HA cluster            = -->
  <!-- ================================================================= -->
<DB2Cluster xmlns:xsi="http://www.w3.org/2001/XMLSchema-instance" xsi:noNamespaceSchemaLocation="db2ha.xsd" clusterManagerName="TSA" version="1.0">
  <!-- ================================================================= -->
  <!-- = ClusterDomain element       	                                 = -->
  <!-- = This element encapsulates the cluster configuration           = -->
  <!-- = specification                                                 = -->
  <!-- = Creating cluster domain of name db2HAdomain                   = -->
  <!-- = Creating an IP quorum device (IP 19.126.4.5)                  = -->
  <!-- = The IP must be pingable at all times by each of the nodes in  = -->
  <!-- = the cluster domain                                            = --> 
  <!-- ================================================================= -->
  <ClusterDomain domainName="db2HAdomain">
     <Quorum quorumDeviceProtocol="network" quorumDeviceName="19.126.4.5"/>
  <!-- ================================================================= -->
  <!-- = Physical network element                                      = -->
  <!-- = The physical network specifies the network type, protocol     = -->
  <!-- = IP address, subnet mask, and NIC name                         = -->
  <!-- = Create network of name db2_public_network_0                   = -->
  <!-- ================================================================= -->
     <PhysicalNetwork physicalNetworkName="db2_public_network_0" physicalNetworkProtocol="ip">
      <Interface interfaceName="eth0" clusterNodeName="hasys01">
        <IPAddress baseAddress="19.126.52.139" subnetMask="255.255.255.0" networkName="db2_public_network_0"/>
      </Interface>              
      <Interface interfaceName="eth0" clusterNodeName="hasys02">
        <IPAddress baseAddress="19.126.52.140" subnetMask="255.255.255.0" networkName="db2_public_network_0"/>
      </Interface>              
     </PhysicalNetwork>
  <!-- ================================================================= -->
  <!-- = ClusterNodeName element                                       = -->
  <!-- = The set of nodes in the cluster domain                        = -->
  <!-- = Here the defined set of nodes in the domain is                = -->
  <!-- = hasys01, hasys02                                              = -->
  <!-- ================================================================= -->
     <ClusterNode clusterNodeName="hasys01"/>
     <ClusterNode clusterNodeName="hasys02"/>
  </ClusterDomain>
  <!-- ================================================================= -->
  <!-- = Failover policy element                                       = -->
  <!-- = The failover policy specifies the failover order of the       = -->
  <!-- = cluster nodes                                                 = -->
  <!-- = In the current sample the failover policy is mutual take over = -->
  <!-- ================================================================= -->
  <FailoverPolicy>
     <Mutual></Mutual>
  </FailoverPolicy>
  <!-- ================================================================= -->
  <!-- = DB2 Partition element                                         = -->
  <!-- = The DB2 partition type specifies a DB2 Instance Name,         = -->
  <!-- = partition number, virtual IP address, Subnet mask,            = -->
  <!-- = mount resource and the                                        = -->
  <!-- = mutual failover nodes (hasys01, hasys02)                      = -->
  <!-- ================================================================= -->
  <DB2PartitionSet>
    <DB2Partition dbpartitionnum="0" instanceName="db2inst1">
       <VirtualIPAddress baseAddress="19.126.52.222" subnetMask="255.255.255.0" networkName="db2_public_network_0"/>
       <Mount filesystemPath="/hafs/db2inst1"/>
       <MutualPair systemPairNode1="hasys01" systemPairNode2="hasys02" />
    </DB2Partition>
  </DB2PartitionSet>
</DB2Cluster>
